{
  "id": "mirror_vector_pack",
  "display_name": "Mirror Vector Pack",
  "author": "Creator",
  "version": "1.0.0",
  "schema_version": 4,
  "description": "A configurable apex-slingshot resonance weave.",
  "tags": ["community", "gravity", "reduced-flash-ready"],
  "dependencies": [],
  "conflicts": [],
  "load_after": [],
  "load_before": [],
  "options": [
    {
      "id": "intensity",
      "display_name": "Resonance Intensity",
      "type": "float",
      "default": 0.6,
      "min": 0.25,
      "max": 1.0,
      "step": 0.05,
      "network_category": "deterministic_seed"
    }
  ],
  "content": {
    "law_weaves": [
      {
        "id": "mirror_apex",
        "display_name": "Mirror Apex",
        "hooks": ["slingshot_apex"],
        "network_category": "deterministic_seed",
        "cooldown": 5,
        "max_triggers": 4,
        "conditions": [
          {"type": "min_wave", "value": 3},
          {"type": "mod_option", "manifest_id": "mirror_vector_pack", "option_id": "intensity", "operator": "greater_or_equal", "value": 0.5}
        ],
        "effects": [
          {"action": "create_resonance_zone", "zone_type": "harmonic_orbit", "radius": 220, "intensity": 0.6}
        ]
      }
    ]
  }
}
